登记号,相关登记号,药物名称,药物类型,备案号,适应症,试验专业题目,试验通俗题目,试验方案编号,方案最新版本号,版本日期,方案是否为联合用药,申请人名称,联系人姓名,联系人座机,联系人手机号,联系人Email,联系人邮政地址,联系人邮编,试验目的,试验分类,试验分期,设计类型,随机化,盲法,试验范围,受试者年龄,受试者性别,健康受试者,入选标准,排除标准,试验药,对照药,主要终点指标及评价时间,次要终点指标及评价时间,主要研究者信息,各参加机构信息,伦理委员会信息,数据安全监查委员会,为受试者购买试验伤害保险,主要研究者信息,各参加机构信息,伦理委员会信息,试验状态,试验人数,受试者招募及试验完成日期,临床试验结果摘要
CTR20201763,,吗替麦考酚酯胶囊 曾用名:,化学药物,B202000189-01,可用于预防同种肾移植病人的排斥反应，及治疗难治性排斥反异，可与环孢素和肾上腺皮质激素同时应用。,吗替麦考酚酯胶囊在健康人群单中心、随机、开放、双周期、自身交叉、单剂量空腹试验和单中心、随机、开放、三周期、半重复交叉、单剂量餐后试验,吗替麦考酚酯胶囊人体生物等效性试验,JY-BE-MMF-2019-01,1.1,2020-07-17,否 ,"['湖南华纳大药厂股份有限公司', '1']",张静,0731-85910585,18613997826,zhangjing@warrant.com.cn,湖南省-长沙市-高新区麓天路28号五矿麓谷科技园C7栋3楼,410205,分别采用单中心、随机、开放、双周期、自身交叉、单剂量给药设计评价空腹给药条件下和单中心、随机、开放、三周期、半重复交叉、单剂量给药设计评价餐后给药条件下，湖南华纳大药厂股份有限公司生产的吗替麦考酚酯胶囊（250 mg/粒）与上海罗氏制药有限公司生产的吗替麦考酚酯胶囊（250 mg/粒），商品名：骁悉®）在中国健康人群吸收程度和吸收速度的差异，并评价湖南华纳大药厂股份有限公司生产的吗替麦考酚酯胶囊的安全性。,生物等效性试验/生物利用度试验,其它BE试验,交叉设计,随机化,开放,国内试验,18岁(最小年龄)至60岁(最大年龄),男,有,1年龄在18周岁至60周岁（含边界值）的中国健康志愿者，男性2体重不小于50 kg；体重指数在19~26 kg/m2范围内（包括临界值）3试验前签署知情同意书、并对试验内容、过程及可能出现的不良反应充分了解4志愿者能够和研究者进行良好的沟通，并且理解和遵守本项研究的各项要求,1试验前3个月内参加过其他任何临床试验者2对吗替麦考酚酯、麦考酚酸或药物中的其他成分有超敏反应者3三年内有慢性或活动性消化道疾病如食管疾病、胃炎、胃溃疡、憩室炎、肠炎，活动性胃肠道出血、胃肠道穿孔或消化道手术者4有心血管系统、内分泌系统、神经系统、血液系统、免疫系统（包括个人或家族史遗传性免疫缺陷）、精神病、代谢异常、恶性肿瘤、淋巴组织增生性疾病等病史且研究者认为目前仍有临床意义者5有体位性低血压、晕针或晕血病史或静脉穿刺采血不耐受者6试验前3个月内接种过，或试验中、试验后3个月内计划接种疫苗者7密切接触人群患有传播性的细菌、病毒感染（包括水痘病毒、流感病毒）者8试验前6个月内接受过经研究者判断会影响药物吸收、分布、代谢、排泄的手术者；或试验前4周内接受过外科手术；或计划在研究期间进行外科手术者9试验前14天内因各种原因使用过任何药物（包括中草药）者10试验前30天内使用过任何抑制或诱导肝脏对药物代谢的药物者11试验前3个月内献血者或大量失血（＞200 mL）或试验期间/试验结束后3个月内有献血计划者12药物滥用者或试验前3个月使用过软毒品（如：大麻）或试验前1年服用硬毒品（如：甲基安非他明、苯环己哌啶等）者13嗜烟者或试验3个月内每日吸烟量多于5支者，或试验期间不能停止使用任何烟草类产品14酗酒者或试验前6个月内经常饮酒者，即每周饮酒超过14单位酒精（1单位=360 mL啤酒或45 mL酒精量为40%的烈酒或150 mL葡萄酒）；或试验期间不愿意停止饮酒或任何含酒精的制品15每天饮用过量茶、咖啡和/或含咖啡因的饮料（8杯以上，1杯=250 mL）者，或不同意试验期间停止饮用茶、咖啡和/或含咖啡因的饮料者16对饮食有特殊要求，不能遵守统一饮食者；或乳糖不耐受者17试验期间或试验结束后3个月内有捐精计划，或试验期间不愿采取一种或一种以上的非药物避孕措施（如完全禁欲、伴侣结扎等）者18在服用研究药物前3天内进食可能影响药物体内代谢的饮食（包括葡萄柚或葡萄柚产品、火龙果、芒果、柚子、橘子等），或研究者认为有其他影响药物吸收、分布、代谢、排泄的饮食者19试验前生命体征检查异常且有临床意义者，由研究者参考正常范围后综合判定20试验前体格检查异常且有临床意义者21试验前实验室检查异常且有临床意义者22试验前心电图异常且有临床意义者23试验前胸部X线（正侧位）检查结果异常且有临床意义者24受试者可能因为其他原因而不能完成本研究或经研究者判断具有其它不宜参加试验原因者,序号名称用法1中文通用名:吗替麦考酚酯胶囊英文通用名:Mycophenolate mofetil capsules商品名称:浦津 剂型:胶囊 规格:250mg 用法用量:单次给药1粒 用药时程:每周期（7天）单次给药,序号名称用法1中文通用名:吗替麦考酚酯胶囊英文通用名:Mycophenolate mofetil capsules商品名称:浦津 剂型:胶囊 规格:250mg 用法用量:单次给药1粒 用药时程:每周期（7天）单次给药,序号指标评价时间终点指标选择1血浆药物峰浓度（Cmax）、药物浓度-时间曲线下面积(AUC)给药后48h有效性指标,序号指标评价时间终点指标选择1达峰时间(Tmax)；安全性评价：生命体征（血压、脉搏、体温）、体格检查、实验室检查和不良事件整个试验过程有效性指标+安全性指标,1姓名张毕奎学位药理学博士职称主任药师电话0731-85292098Emailbikui_zh@vip.126.com邮政地址湖南省-长沙市-万家丽北路61号邮编410100单位名称湘雅博爱康复医院,序号机构名称主要研究者国家省（州）城市1湘雅博爱康复医院张毕奎中国湖南省长沙市,序号名称审查结论批准日期/备案日期1湘雅博爱康复医院伦理委员会同意 2020-01-13,无,有,1姓名张毕奎学位药理学博士职称主任药师电话0731-85292098Emailbikui_zh@vip.126.com邮政地址湖南省-长沙市-万家丽北路61号邮编410100单位名称湘雅博爱康复医院,序号机构名称主要研究者国家省（州）城市1湘雅博爱康复医院张毕奎中国湖南省长沙市,序号名称审查结论批准日期/备案日期1湘雅博爱康复医院伦理委员会同意 2020-01-13,进行中（尚未招募）          ,目标入组人数                国内: 48 人；已入组人数国内: 登记人暂未填写该信息；实际入组总人数国内: 登记人暂未填写该信息；,第一例受试者签署知情同意书日期国内：登记人暂未填写该信息；    第一例受试者入组日期国内：登记人暂未填写该信息；           试验完成日期        国内：登记人暂未填写该信息；    ,序号版本号版本日期暂未填写此信息
CTR20201713,,HX008注射液（重组人源化抗PD-1单克隆抗体）HX008注射液（重组人源化抗PD-1单克隆抗体）,生物制品,,既往未接受过系统性标准治疗的晚期或转移性非鳞非小细胞肺癌患者,重组人源化抗PD-1单克隆抗体（HX008）联合化疗对比帕博利珠单抗联合化疗作为一线方案治疗晚期或转移性非鳞非小细胞肺癌（NSCLC）的II/III期临床研究,重组人源化抗PD-1单克隆抗体（HX008）联合化疗对比帕博利珠单抗联合化疗作为一线方案治疗晚期或转移性非鳞非小细胞肺癌（NSCLC）的II/III期临床研究,HX008-NSCLC-II/Ⅲ-01,1.1版,2020-05-26,是  ,"['泰州翰中生物医药有限公司', '1']",李雪皓,010-80123990,15524299116,xuehao_li@lepubiopharma.com,北京市-北京市-昌平区超前路37号院7号楼,102200,主要目的：1)探索HX008联合化疗作为一线方案治疗晚期或转移性非鳞非小细胞肺癌的安全性和耐受性；2)探索HX008联合化疗作为一线方案治疗晚期或转移性非鳞非小细胞肺癌的客观有效率（ORR）次要目的：1)探索HX008联合化疗作为一线方案治疗晚期或转移性非鳞非小细胞肺癌的无进展生存期（PFS）、缓解持续时间（DOR）、1年无进展生存率、总生存期（OS）；2)评价HX008的药代动力学及免疫原性探索性目的： 探索受试者肿瘤组织中程序性死亡配体1（PD-L1）的表达量等指标与疗效（PFS、OS、ORR等）之间的关系，为明确获益优势人群提供参考,安全性和有效性,II期,单臂试验,非随机化,开放,国内试验,18岁(最小年龄)至无上限(最大年龄),男+女,无,"11)自愿签署知情同意书，了解本研究并愿意遵循而且有能力完成所有试验程序22)男女不限，年龄≥18岁者33)组织学或细胞学确诊为IV期(M1a/b-AJCC第七版)非鳞状NSCLC者44)针对晚期或转移性NSCLC未接受过系统性治疗(辅助/新辅助治疗末次用药后大于12个月出现疾病进展者可入组)55)无EGFR或ALK靶向治疗指征的患者（无EGFR突变、ALK基因重排）66)受试者须有至少1个可测量病灶（按照RECIST1.1标准），如果将既往接受过放疗的病灶作为靶病灶，须确认该病灶为疾病进展，如果有至少1个其他可测量的靶病灶，则可将既往接受过放疗的病灶作为非靶病灶进行随访77)随机前需提供组织样本检测PD-L1表达水平，患者需提供未接受过放疗的肿瘤组织样本，且组织样本最好取至患者被诊断为转移性病变之后，如果患者无法提供近期的组织样本，可以接受（新）辅助治疗前的组织样本88)预计生存期至少3个月者99)美国东部肿瘤协作组（ECOG）评分体能状态为0或1者1010)有适宜的器官功能, 根据以下实验室检查：？ 血清白蛋白≥2.5g/dL；？ 嗜中性细胞绝对计数(ANC)≥1.5×109/L；？ 白细胞绝对计数(WBC)≥3.0×109/L；？ 血小板≥100×109/L；？ 血红蛋白≥90g/L，入组前4周内未输血；？ 肌酐清除率(CrCl)≥50 mL/min；？  AST 和 ALT≤2.5 倍 ULN，肝转移患者≤5倍ULN；？ 血清总胆红素(TBIL)≤1.5倍ULN，对于血清总胆红素&gt;1.5倍ULN的患者，直接胆红素需≤ULN；？ 国际标准化比率(INR)或凝血酶原时间（PT）≤1.5倍ULN (正在接受抗凝血治疗的病人除外)，或活化部分凝血活酶时间 (APTT) 或部分凝血活酶时间（PTT）≤1.5倍 ULN (正在接受抗凝血治疗的病人除外)1111)有妊娠可能性的女性，需在首次给药前72小时内进行尿液或血清妊娠试验，且结果为阴性；如果尿检呈阳性或不能确认为阴性，则需进行血清妊娠检查",1组织学检测显示以鳞状细胞为主的非小细胞肺癌，混合型肿瘤如果存在小细胞成分，则受试者不能入组2本研究首次给药之前：a.针对转移性疾病接受过全身性细胞毒性化疗或抗肿瘤生物治疗(如厄洛替尼、克唑替尼、西妥昔单抗等)；b.首次给药前3周内接受过重大手术；c.首次给药前4周内参加过其他临床试验（药物或器械）；d.首次给药前6个月内对肺进行过&gt; 30 Gy的放疗；e.首次给药前7天内进行过姑息性放疗；f.首次给药前30天内接种过活病毒疫苗（接种不含活病毒的季节性流感疫苗可入组）3合并有临床活动性憩室炎、腹腔脓肿、胃肠道梗阻、腹膜癌、活动性消化道溃疡、消化道活动性出血、消化道穿孔4首次使用研究药物前5年内曾诊断为任何其它恶性肿瘤的患者，除外经充分治疗后具有低转移风险和死亡风险的恶性肿瘤（5年生存率&gt;90%），如经充分治疗的基底细胞或鳞状细胞皮肤癌或宫颈原位癌及其它原位癌5已知对大分子蛋白制剂/单克隆抗体、顺铂、卡铂或培美曲塞的任何成分过敏6有器官移植史，或干细胞移植史7曾接受过其他抗PD-1、PD-L1或PD-L2制剂或针对其他免疫调节受体或机制的抗体治疗，包括(但不限于)针对IDO、PD-L1、IL-2R、GITR的抗体；或曾接受过帕博利珠单抗治疗者；8首次给药前有严重感染由研究者判定不符合参加试验的患者9既往有明确的神经或精神障碍史，如癫痫、痴呆症，或经常使用任何非法药物或(在最近一年内)有药物滥用(包括酒精)史，可能影响试验依从性者10妊娠期或哺乳期者，或计划在试验期间妊娠或生育者11患有活动性肺结核12经治疗未控制稳定的系统性疾病，如心脑血管疾病、糖尿病、高血压等13研究者判断由于其他原因（如可能会干扰本研究的既往或现患并发症、异常实验室检查结果等）不适合参加该试验的受试者,序号名称用法1中文通用名:HX008注射液（重组人源化抗PD-1单克隆抗体）英文通用名:HX008商品名称:NA 剂型:注射剂 规格:10ml：100mg 用法用量:剂型：HX008注射液 规格：100mg/10mL/支 给药途径：静脉滴注 用药频次：每三周给药一次（q3W） 剂量：200mg/人/次固定剂量 用药时程:45min（±15min）,序号名称用法1中文通用名:HX008注射液（重组人源化抗PD-1单克隆抗体）英文通用名:HX008商品名称:NA 剂型:注射剂 规格:10ml：100mg 用法用量:剂型：HX008注射液 规格：100mg/10mL/支 给药途径：静脉滴注 用药频次：每三周给药一次（q3W） 剂量：200mg/人/次固定剂量 用药时程:45min（±15min）,序号指标评价时间终点指标选择11)探索HX008联合化疗作为一线方案治疗晚期或转移性非鳞非小细胞肺癌的安全性和耐受性；2)探索HX008联合化疗作为一线方案治疗晚期或转移性非鳞非小细胞肺癌的客观有效率（ORR）入组50%进行中期分析，试验结束后进行整体统计分析。有效性指标+安全性指标,序号指标评价时间终点指标选择11)探索无进展生存期（PFS）、缓解持续时间（DOR）、1年无进展生存率、总生存期（OS）；2)评价HX008的药代动力学及免疫原性入组50%进行中期分析，试验结束后进行整体统计分析。有效性指标,1姓名周彩存学位医学博士职称主任医师电话021-65115006-3051Emailcaicunzhoudr@163.com邮政地址上海市-上海市-上海市肺科医院肿瘤科 上海市政民路507号邮编200433单位名称同济大学附属上海市肺科医院,序号机构名称主要研究者国家省（州）城市1同济大学附属上海市肺科医院周彩存中国上海市上海市2北京肿瘤医院方健中国北京市北京市3杭州市第一人民医院陈雪琴中国浙江省杭州市4安徽省立医院操乐杰中国安徽省合肥市5中南大学湘雅医院潘颖华中国湖南省长沙市6湖南省肿瘤医院邬麟中国湖南省长沙市7北京朝阳医院葛洋中国北京市北京市8北医三院曹宝山中国北京市北京市9哈尔滨医科大学附属肿瘤医院于雁中国黑龙江省哈尔滨市10辽宁省肿瘤医院李晓玲中国辽宁省沈阳市,序号名称审查结论批准日期/备案日期1上海市肺科医院伦理审查委员会同意 2020-07-24,无,有,1姓名周彩存学位医学博士职称主任医师电话021-65115006-3051Emailcaicunzhoudr@163.com邮政地址上海市-上海市-上海市肺科医院肿瘤科 上海市政民路507号邮编200433单位名称同济大学附属上海市肺科医院,序号机构名称主要研究者国家省（州）城市1同济大学附属上海市肺科医院周彩存中国上海市上海市2北京肿瘤医院方健中国北京市北京市3杭州市第一人民医院陈雪琴中国浙江省杭州市4安徽省立医院操乐杰中国安徽省合肥市5中南大学湘雅医院潘颖华中国湖南省长沙市6湖南省肿瘤医院邬麟中国湖南省长沙市7北京朝阳医院葛洋中国北京市北京市8北医三院曹宝山中国北京市北京市9哈尔滨医科大学附属肿瘤医院于雁中国黑龙江省哈尔滨市10辽宁省肿瘤医院李晓玲中国辽宁省沈阳市,序号名称审查结论批准日期/备案日期1上海市肺科医院伦理审查委员会同意 2020-07-24,进行中（尚未招募）          ,目标入组人数                国内: 60 人；已入组人数国内: 登记人暂未填写该信息；实际入组总人数国内: 登记人暂未填写该信息；,第一例受试者签署知情同意书日期国内：登记人暂未填写该信息；    第一例受试者入组日期国内：登记人暂未填写该信息；           试验完成日期        国内：登记人暂未填写该信息；    ,序号版本号版本日期暂未填写此信息
